{
  "artifact_type": "attribute_classification_fixture",
  "case_type": "negative",
  "description": "contradictory predicates",
  "expected": {
    "assertions": [
      {
        "assertion_id": "ASSERT-AC004-NEG-001-001",
        "expected": {
          "failure_codes": [
            "AC004"
          ],
          "outcome": "governed_stop"
        },
        "subject_pointer": "/expected",
        "type": "governed_stop"
      },
      {
        "assertion_id": "ASSERT-AC004-NEG-001-002",
        "expected": {
          "artifact_publication_allowed": false,
          "failure_stage": "predicate",
          "partial_records_allowed": false,
          "records_emitted": false,
          "resolution_emitted": false
        },
        "subject_pointer": "/expected/record_emission_policy",
        "type": "record_emission"
      }
    ],
    "failure_codes": [
      "AC004"
    ],
    "outcome": "governed_stop",
    "record_emission_policy": {
      "artifact_publication_allowed": false,
      "failure_stage": "predicate",
      "partial_records_allowed": false,
      "records_emitted": false,
      "resolution_emitted": false
    },
    "records": []
  },
  "fixture_id": "AC004-NEG-001",
  "input_artifacts": [
    {
      "path": "05_src/traffic_simulation/validation/fixtures/attribute_classification/inputs.json",
      "role": "classification_input",
      "sha256": "a8a3a5b27b3e4badfe7c74dd92ea1476679418e8c49a78529591b2fe5be88e56"
    }
  ],
  "oracle": {
    "independently_authored": true,
    "path": "05_src/traffic_simulation/validation/fixtures/attribute_classification/oracles.json",
    "sha256": "22f4c887703b2676e5d71da1fd7ceb760dcd9c7d56560f4eeed55a1dfc6393dc",
    "source_specification_sha256": "af5a45c7cb5b325ade6da7660c54d5318002403a80bfc748476d65563d5f50ba"
  },
  "repeat_assertion": null,
  "requirement_ids": [
    "AC-REQ-004"
  ],
  "schema_version": 2
}
