{
  "artifact_type": "attribute_classification_fixture",
  "case_type": "negative",
  "description": "required human review is incomplete",
  "expected": {
    "assertions": [
      {
        "assertion_id": "ASSERT-AC007-NEG-001-001",
        "expected": {
          "failure_codes": [
            "AC007"
          ],
          "outcome": "governed_stop"
        },
        "subject_pointer": "/expected",
        "type": "governed_stop"
      },
      {
        "assertion_id": "ASSERT-AC007-NEG-001-002",
        "expected": {
          "artifact_publication_allowed": false,
          "failure_stage": "resolution",
          "partial_records_allowed": true,
          "records_emitted": true,
          "resolution_emitted": true
        },
        "subject_pointer": "/expected/record_emission_policy",
        "type": "record_emission"
      }
    ],
    "failure_codes": [
      "AC007"
    ],
    "outcome": "governed_stop",
    "record_emission_policy": {
      "artifact_publication_allowed": false,
      "failure_stage": "resolution",
      "partial_records_allowed": true,
      "records_emitted": true,
      "resolution_emitted": true
    },
    "records": [
      {
        "classification": {
          "criticality_level": "S3",
          "matched_rule_ids": [
            "SPEED-CRIT-003"
          ],
          "selected_rule_id": "SPEED-CRIT-003"
        },
        "classification_record_id": "acr:1007:maxspeed:formal",
        "resolution": {
          "conflict_resolution_rule_id": null,
          "evidence_candidates": [],
          "evidence_requirement": {
            "description": "High-criticality resolution requires governed attribute-specific evidence.",
            "minimum_authority": "reviewed_public_source",
            "required": true,
            "requirement_rule_id": "EVID-REQ-HIGH-001"
          },
          "rejected_evidence_ids": [],
          "resolution_action": "require_human_review",
          "resolution_rule_id": null,
          "resolved_value": null,
          "review_status": "review_required",
          "reviewed_at": null,
          "reviewer": null,
          "selected_evidence_id": null,
          "stop_failure_codes": [
            "AC007"
          ],
          "unit": null,
          "value_state": "conditional"
        }
      }
    ]
  },
  "fixture_id": "AC007-NEG-001",
  "input_artifacts": [
    {
      "path": "05_src/traffic_simulation/validation/fixtures/attribute_classification/inputs.json",
      "role": "classification_input",
      "sha256": "a8a3a5b27b3e4badfe7c74dd92ea1476679418e8c49a78529591b2fe5be88e56"
    }
  ],
  "oracle": {
    "independently_authored": true,
    "path": "05_src/traffic_simulation/validation/fixtures/attribute_classification/oracles.json",
    "sha256": "98b6a007e4828e42570a17d9255bdd029295afddf6307d1a6f3f63f8bc96664a",
    "source_specification_sha256": "14a504255d9413c77c981858fafc99e4021bbf2283a94a761b1c1e22254402a2"
  },
  "repeat_assertion": null,
  "requirement_ids": [
    "AC-REQ-007"
  ],
  "schema_version": 2
}
