{
  "artifact_type": "attribute_classification_fixture",
  "case_type": "negative",
  "description": "retained tuple missing",
  "expected": {
    "assertions": [
      {
        "assertion_id": "ASSERT-AC001-NEG-001-001",
        "expected": {
          "failure_codes": [
            "AC001"
          ],
          "outcome": "governed_stop"
        },
        "subject_pointer": "/expected",
        "type": "governed_stop"
      },
      {
        "assertion_id": "ASSERT-AC001-NEG-001-002",
        "expected": {
          "artifact_publication_allowed": false,
          "failure_stage": "schema",
          "partial_records_allowed": false,
          "records_emitted": false,
          "resolution_emitted": false
        },
        "subject_pointer": "/expected/record_emission_policy",
        "type": "record_emission"
      },
      {
        "assertion_id": "ASSERT-AC001-NEG-001-003",
        "expected": {
          "mutations": [
            "missing_required_field",
            "enum_out_of_range",
            "type_mismatch",
            "invalid_sha256",
            "invalid_timestamp",
            "additional_property",
            "invalid_record_id",
            "attribute_level_mismatch"
          ]
        },
        "subject_pointer": "/input/scenario/schema_mutations",
        "type": "schema_rejection"
      }
    ],
    "failure_codes": [
      "AC001"
    ],
    "outcome": "governed_stop",
    "record_emission_policy": {
      "artifact_publication_allowed": false,
      "failure_stage": "schema",
      "partial_records_allowed": false,
      "records_emitted": false,
      "resolution_emitted": false
    },
    "records": []
  },
  "fixture_id": "AC001-NEG-001",
  "input_artifacts": [
    {
      "path": "05_src/traffic_simulation/validation/fixtures/attribute_classification/inputs.json",
      "role": "classification_input",
      "sha256": "a8a3a5b27b3e4badfe7c74dd92ea1476679418e8c49a78529591b2fe5be88e56"
    }
  ],
  "oracle": {
    "independently_authored": true,
    "path": "05_src/traffic_simulation/validation/fixtures/attribute_classification/oracles.json",
    "sha256": "98b6a007e4828e42570a17d9255bdd029295afddf6307d1a6f3f63f8bc96664a",
    "source_specification_sha256": "14a504255d9413c77c981858fafc99e4021bbf2283a94a761b1c1e22254402a2"
  },
  "repeat_assertion": null,
  "requirement_ids": [
    "AC-REQ-001"
  ],
  "schema_version": 2
}
