{
  "artifact_type": "attribute_classification_fixture",
  "case_type": "boundary",
  "description": "Topology-support way retains a governed nonempty reason",
  "expected": {
    "assertions": [
      {
        "assertion_id": "ASSERT-AC-BND-001-001",
        "expected": {
          "failure_codes": [],
          "outcome": "success"
        },
        "subject_pointer": "/expected",
        "type": "classification"
      },
      {
        "assertion_id": "ASSERT-AC-BND-001-002",
        "expected": {
          "artifact_publication_allowed": true,
          "failure_stage": "none",
          "partial_records_allowed": false,
          "records_emitted": true,
          "resolution_emitted": true
        },
        "subject_pointer": "/expected/record_emission_policy",
        "type": "record_emission"
      }
    ],
    "failure_codes": [],
    "outcome": "success",
    "record_emission_policy": {
      "artifact_publication_allowed": true,
      "failure_stage": "none",
      "partial_records_allowed": false,
      "records_emitted": true,
      "resolution_emitted": true
    },
    "records": [
      {
        "classification": {
          "criticality_level": "L1",
          "matched_rule_ids": [
            "LANE-CRIT-007"
          ],
          "selected_rule_id": "LANE-CRIT-007"
        },
        "classification_record_id": "acr:3001:lanes:structural",
        "resolution": {
          "conflict_resolution_rule_id": null,
          "evidence_candidates": [],
          "evidence_requirement": {
            "description": null,
            "minimum_authority": null,
            "required": false,
            "requirement_rule_id": null
          },
          "rejected_evidence_ids": [],
          "resolution_action": "adopt_explicit",
          "resolution_rule_id": null,
          "resolved_value": 1,
          "review_status": "machine_classified",
          "reviewed_at": null,
          "reviewer": null,
          "selected_evidence_id": null,
          "stop_failure_codes": [],
          "unit": "lanes",
          "value_state": "explicit_osm"
        }
      },
      {
        "classification": {
          "criticality_level": "S1",
          "matched_rule_ids": [
            "SPEED-CRIT-006"
          ],
          "selected_rule_id": "SPEED-CRIT-006"
        },
        "classification_record_id": "acr:3001:maxspeed:structural",
        "resolution": {
          "conflict_resolution_rule_id": null,
          "evidence_candidates": [],
          "evidence_requirement": {
            "description": null,
            "minimum_authority": null,
            "required": false,
            "requirement_rule_id": null
          },
          "rejected_evidence_ids": [],
          "resolution_action": "adopt_explicit",
          "resolution_rule_id": null,
          "resolved_value": "30",
          "review_status": "machine_classified",
          "reviewed_at": null,
          "reviewer": null,
          "selected_evidence_id": null,
          "stop_failure_codes": [],
          "unit": "km/h",
          "value_state": "explicit_osm"
        }
      }
    ]
  },
  "fixture_id": "AC-BND-001",
  "input_artifacts": [
    {
      "path": "05_src/traffic_simulation/validation/fixtures/attribute_classification/inputs.json",
      "role": "classification_input",
      "sha256": "a8a3a5b27b3e4badfe7c74dd92ea1476679418e8c49a78529591b2fe5be88e56"
    }
  ],
  "oracle": {
    "independently_authored": true,
    "path": "05_src/traffic_simulation/validation/fixtures/attribute_classification/oracles.json",
    "sha256": "98b6a007e4828e42570a17d9255bdd029295afddf6307d1a6f3f63f8bc96664a",
    "source_specification_sha256": "14a504255d9413c77c981858fafc99e4021bbf2283a94a761b1c1e22254402a2"
  },
  "repeat_assertion": null,
  "requirement_ids": [
    "AC-REQ-004",
    "AC-REQ-010"
  ],
  "schema_version": 2
}
